{"$schema":"https://json-schema.org/draft/2020-12/schema","$id":"schemas/gamification.schema.json","title":"GamificationProjection","type":"object","additionalProperties":false,"required":["expedition_id","participant_id","rules_version","role_mastery","contribution","sync_state"],"properties":{"expedition_id":{"type":"string","pattern":"^[a-z0-9_]+$"},"participant_id":{"type":"string","pattern":"^[a-z0-9_]+$"},"rules_version":{"type":"integer","minimum":1},"role_mastery":{"type":"array","items":{"type":"object","additionalProperties":false,"required":["role_id","xp","level"],"properties":{"role_id":{"type":"string","pattern":"^[a-z0-9_]+$"},"xp":{"type":"integer","minimum":0},"level":{"enum":["observer","crew","practiced","lead","mentor"]},"next_level_xp":{"type":["integer","null"],"minimum":0}}}},"contribution":{"type":"object","additionalProperties":false,"required":["score","rank","status","snapshot_at"],"properties":{"score":{"type":"number","minimum":0,"maximum":100},"rank":{"type":["integer","null"],"minimum":1},"status":{"enum":["active","inactive","not_enough_data"]},"snapshot_at":{"type":"string","format":"date-time"}}},"sync_state":{"enum":["provisional","synced","conflict","rejected"]}}}